title,type,topic,route_stage,place,question,answer,extended_note,keywords
长征为什么要开始,faq,长征史,瑞金出发,江西瑞金,红军为什么要进行长征,由于第五次反围剿失利和中央苏区形势恶化，中央红军必须实行战略转移以保存革命骨干力量并寻找新的发展空间。,理解这一问题要把长征放在革命危局中看。长征不是普通行军，而是在强敌压迫下作出的重大政治军事决策。,长征、开始、原因、战略转移
长征的起点在哪里,faq,长征史,瑞金出发,江西瑞金,长征是从哪里开始的,中央红军主力从江西瑞金等中央苏区地区出发，瑞金因此被视为长征的重要起点。,瑞金出发之后还要经过于都河大规模渡河，这两个节点共同构成长征初期的历史起点叙事。,起点、瑞金、出发
于都河为什么重要,faq,长征史,于都河出发,江西于都,于都河在长征中有什么意义,于都河是中央红军正式大规模渡河出发的重要地点，也集中体现了军民同心支前的历史场景。,于都河的重要性不仅在于地理位置，更在于群众帮助红军架桥摆渡和运送物资所体现出的群众路线。,于都河、渡河、群众
突破封锁线说明了什么,faq,长征史,突破四道封锁线,赣南湘南一线,长征初期突破封锁线说明了什么,它说明红军具有顽强战斗力和组织力，但也暴露出机动速度不足和整体仍然被动的问题。,从战术突破到战略主动之间并不相等，这正是理解长征初期危局的重要角度。,封锁线、突破、初期危局
湘江战役为什么重要,faq,长征史,湘江战役,广西全州兴安灌阳一带,湘江战役为什么是关键节点,湘江战役牺牲巨大，迫使党和红军更加深刻地反思此前军事路线问题，是通向后续战略转折的重要历史前提。,它既是一场惨烈战役，也是一场深刻警醒。后来的通道转兵和遵义会议都与此密切相关。,湘江、牺牲、转折前提
通道转兵改变了什么,faq,长征史,通道转兵,湖南通道,通道转兵的历史作用是什么,通道转兵改变了原有高风险行军方向，使红军避免再次陷入重围，开始争取战略主动。,理解这一节点要突出方向调整和实事求是，它是从被动走向主动的重要起点。,通道转兵、方向调整、主动
黎平会议有什么作用,faq,长征史,黎平会议,贵州黎平,黎平会议为什么重要,黎平会议进一步明确了红军向贵州前进的方向，使路线调整从战场判断上升为较明确的组织决策。,它虽不是最终转折点，却是通向遵义会议的重要组织准备环节。,黎平会议、贵州方向、组织决策
猴场会议为什么值得关注,faq,长征史,猴场会议,贵州瓮安猴场,猴场会议在长征中起什么作用,猴场会议进一步推动战略指导思想调整，强调根据实际情况灵活机动作战，是遵义会议前的重要思想准备。,它说明长征中的重大转折并不是突然发生，而是经过一系列节点逐步形成的。,猴场会议、思想准备、灵活机动
遵义会议的意义是什么,faq,长征史,遵义会议,贵州遵义,遵义会议为什么是转折点,遵义会议开始确立以毛泽东为代表的正确领导，独立自主解决了中国革命中的重大问题，成为党历史上生死攸关的转折点。,理解遵义会议要同时看到领导调整、路线转变和独立自主三个层面。,遵义会议、转折点、独立自主
娄山关战斗说明了什么,faq,长征史,娄山关战斗,贵州遵义北部,娄山关战斗为什么重要,它体现了遵义会议后红军作战开始更加主动灵活，也显著增强了部队士气和对新方向的信心。,娄山关战斗常与遵义会议放在一起学习，因为它让路线转折开始在战场上显出成效。,娄山关、主动、转折后
四渡赤水体现了什么,faq,长征史,四渡赤水,贵州四川云南交界地区,四渡赤水体现了怎样的军事智慧,四渡赤水体现了高度灵活机动和以运动战争取主动的作战智慧，是长征军事史上的经典战例。,理解四渡赤水不要只看渡河次数，更要看到它如何通过回旋调动敌军并创造战略空间。,四渡赤水、机动、军事智慧
巧渡金沙江有什么意义,faq,长征史,巧渡金沙江,云南禄劝四川会理一带,红军为什么一定要渡过金沙江,因为金沙江是重要天然屏障，成功渡江才能跳出西南地区的高压围堵并继续北上。,金沙江节点与四渡赤水共同构成长征中段由危转安的重要战略突破。,金沙江、北上、脱险
飞夺泸定桥为什么会成为象征,faq,长征史,飞夺泸定桥,四川泸定,飞夺泸定桥为什么总被反复讲述,因为它既保障了主力继续北上的战略通道，又集中体现了不怕牺牲勇于胜利的革命英雄主义精神。,学习泸定桥时要同时看到战略价值和精神象征两层含义，这样理解才完整。,泸定桥、英雄主义、象征
雪山草地为什么常被并提,faq,长征史,翻越雪山,川西高原和草地地区,为什么总说翻雪山过草地,因为雪山和草地最能集中体现长征后段在极端自然环境中的艰苦行军，是理解长征艰苦奋斗精神的代表性场景。,雪山强调高寒缺氧，草地更突出泥沼饥饿和长期消耗，两者共同构成长征后段的艰险高峰。,雪山、草地、艰苦奋斗
榜罗镇会议说明了什么,faq,长征史,榜罗镇会议,甘肃通渭榜罗镇,榜罗镇会议的核心意义是什么,榜罗镇会议明确了到陕北去的战略方向，使长征后段目标更加清晰，也把长征与新的革命落脚点联系起来。,它说明长征后段不是盲目前进，而是越来越明确地服务于革命全局布局。,榜罗镇、陕北、战略方向
吴起镇会师意味着什么,faq,长征史,吴起镇会师,陕西吴起镇,吴起镇会师为什么重要,吴起镇会师标志中央红军长征取得决定性胜利，并在陕北获得新的落脚点和整顿恢复空间。,中央红军到达陕北后，长征从持续转移转入新的斗争阶段，因此吴起镇意义重大。,吴起镇、陕北、决定性胜利
会宁会师为什么是伟大胜利标志,faq,长征史,会宁会师,甘肃会宁,会宁会师对中国革命意味着什么,会宁会师意味着红军三大主力从全局上完成了长征这场伟大战略转移，保存了革命骨干力量并形成新的发展空间。,它不仅是路线终点，也是长征精神得到集中升华的重要标志。,会宁会师、伟大胜利、全局
为什么说长征是战略转移,faq,长征史,,中国,为什么说长征本质上是战略转移,因为长征的根本目标是保存党和红军骨干力量，摆脱敌军围堵，重新寻找革命发展的有利空间，而不是单纯意义上的远距离行军。,把长征理解成战略转移，有助于把各个节点放回革命全局和军事全局中去认识。,战略转移、长征本质、全局
长征精神包括哪些内容,faq,长征精神,,中国,长征精神包括哪些方面,长征精神主要包括坚定理想信念、实事求是、独立自主、顾全大局、紧密团结、依靠群众、艰苦奋斗和勇于胜利等方面。,这些精神并不是抽象概念，而是在瑞金出发、遵义会议、四渡赤水、雪山草地等具体历史场景中形成的。,长征精神、理想信念、艰苦奋斗
